{
 "id": "item.piedra-de-la-buena-fortuna-piedra-de-la-suerte",
 "name": "Piedra de la buena fortuna (piedra de la suerte)",
 "category": "Objeto maravilloso",
 "variant": null,
 "rarity": "infrecuente",
 "attunement": true,
 "attunementRequires": null,
 "subtitle": "Objeto maravilloso, infrecuente (requiere sintonización)",
 "text": "Mientras lleves esta ágata pulida contigo, recibirás un bonificador de +1 a las pruebas de característica y las tiradas de salvación.",
 "blocks": [
  {
   "type": "paragraph",
   "page": 265,
   "md": "Mientras lleves esta ágata pulida contigo, recibirás un bonificador de +1 a las pruebas de característica y las tiradas de salvación.",
   "text": "Mientras lleves esta ágata pulida contigo, recibirás un bonificador de +1 a las pruebas de característica y las tiradas de salvación."
  }
 ],
 "source": {
  "book": "SRD 5.2.1 es",
  "page": 265
 }
}