{
 "id": "item.brasero-para-controlar-elementales-de-fuego",
 "name": "Brasero para controlar elementales de fuego",
 "category": "Objeto maravilloso",
 "variant": null,
 "rarity": "raro",
 "attunement": false,
 "attunementRequires": null,
 "subtitle": "Objeto maravilloso, raro",
 "text": "Mientras estés a 1,5 m o menos de este brasero, puedes emplear una acción de magia para invocar un elemental de fuego. El elemental aparece en un espacio sin ocupar lo más cerca posible del brasero, entiende tus idiomas, obedece tus órdenes y juega su turno inmediatamente después de ti en tu orden de iniciativa. El elemental desaparecerá tras 1 hora, cuando muera o si lo desconvocas como acción adicional. El brasero no puede volver a emplearse de esta manera hasta el siguiente amanecer.",
 "blocks": [
  {
   "type": "paragraph",
   "page": 246,
   "md": "Mientras estés a 1,5 m o menos de este brasero, puedes emplear una acción de magia para invocar un **elemental de fuego**. El elemental aparece en un espacio sin ocupar lo más cerca posible del brasero, entiende tus idiomas, obedece tus órdenes y juega su turno inmediatamente después de ti en tu orden de iniciativa. El elemental desaparecerá tras 1 hora, cuando muera o si lo desconvocas como acción adicional. El brasero no puede volver a emplearse de esta manera hasta el siguiente amanecer.",
   "text": "Mientras estés a 1,5 m o menos de este brasero, puedes emplear una acción de magia para invocar un elemental de fuego. El elemental aparece en un espacio sin ocupar lo más cerca posible del brasero, entiende tus idiomas, obedece tus órdenes y juega su turno inmediatamente después de ti en tu orden de iniciativa. El elemental desaparecerá tras 1 hora, cuando muera o si lo desconvocas como acción adicional. El brasero no puede volver a emplearse de esta manera hasta el siguiente amanecer."
  }
 ],
 "source": {
  "book": "SRD 5.2.1 es",
  "page": 246
 }
}