{
 "id": "item.bandas-de-hierro",
 "name": "Bandas de hierro",
 "category": "Objeto maravilloso",
 "variant": null,
 "rarity": "raro",
 "attunement": false,
 "attunementRequires": null,
 "subtitle": "Objeto maravilloso, raro",
 "text": "Esta esfera de hierro oxidada mide 7,5 cm de diámetro y pesa 0,5 kg. Puedes emplear una acción de magia para lanzarla contra una criatura Enorme o más pequeña que puedas ver a 18 m o menos de ti. En el recorrido del lanzamiento, la esfera se abre en una maraña de bandas de metal.\n\nRealiza una tirada de ataque a distancia con un bonificador de ataque igual a tu modificador por Destreza más tu bonificador por competencia. Si acierta, el objetivo tiene el estado de apresado hasta que utilices una acción adicional para dar una orden y liberarlo. Si haces esto o si el ataque yerra, las bandas se contraerán y volverán a convertirse en una esfera.\n\nCualquier criatura que toque las bandas, incluida la que está apresada, puede emplear una acción para realizar una prueba de Fuerza (Atletismo) con CD 20 para romper las bandas de hierro. Si la supera, el objeto se destruye y la criatura apresada se libera. Si la falla, cualquier otro intento de romper las bandas por parte de la criatura fallará automáticamente hasta que hayan transcurrido 24 horas.\n\nUna vez que se utilizan las bandas, no podrán volver a usarse hasta el siguiente amanecer.",
 "blocks": [
  {
   "type": "paragraph",
   "page": 236,
   "md": "Esta esfera de hierro oxidada mide 7,5 cm de diámetro y pesa 0,5 kg. Puedes emplear una acción de magia para lanzarla contra una criatura Enorme o más pequeña que puedas ver a 18 m o menos de ti. En el recorrido del lanzamiento, la esfera se abre en una maraña de bandas de metal.",
   "text": "Esta esfera de hierro oxidada mide 7,5 cm de diámetro y pesa 0,5 kg. Puedes emplear una acción de magia para lanzarla contra una criatura Enorme o más pequeña que puedas ver a 18 m o menos de ti. En el recorrido del lanzamiento, la esfera se abre en una maraña de bandas de metal."
  },
  {
   "type": "paragraph",
   "page": 236,
   "md": "Realiza una tirada de ataque a distancia con un bonificador de ataque igual a tu modificador por Destreza más tu bonificador por competencia. Si acierta, el objetivo tiene el estado de apresado hasta que utilices una acción adicional para dar una orden y liberarlo. Si haces esto o si el ataque yerra, las bandas se contraerán y volverán a convertirse en una esfera.",
   "text": "Realiza una tirada de ataque a distancia con un bonificador de ataque igual a tu modificador por Destreza más tu bonificador por competencia. Si acierta, el objetivo tiene el estado de apresado hasta que utilices una acción adicional para dar una orden y liberarlo. Si haces esto o si el ataque yerra, las bandas se contraerán y volverán a convertirse en una esfera."
  },
  {
   "type": "paragraph",
   "page": 236,
   "md": "Cualquier criatura que toque las bandas, incluida la que está apresada, puede emplear una acción para realizar una prueba de Fuerza (Atletismo) con CD 20 para romper las bandas de hierro. Si la supera, el objeto se destruye y la criatura apresada se libera. Si la falla, cualquier otro intento de romper las bandas por parte de la criatura fallará automáticamente hasta que hayan transcurrido 24 horas.",
   "text": "Cualquier criatura que toque las bandas, incluida la que está apresada, puede emplear una acción para realizar una prueba de Fuerza (Atletismo) con CD 20 para romper las bandas de hierro. Si la supera, el objeto se destruye y la criatura apresada se libera. Si la falla, cualquier otro intento de romper las bandas por parte de la criatura fallará automáticamente hasta que hayan transcurrido 24 horas."
  },
  {
   "type": "paragraph",
   "page": 236,
   "md": "Una vez que se utilizan las bandas, no podrán volver a usarse hasta el siguiente amanecer.",
   "text": "Una vez que se utilizan las bandas, no podrán volver a usarse hasta el siguiente amanecer."
  }
 ],
 "source": {
  "book": "SRD 5.2.1 es",
  "page": 236
 }
}