{
 "id": "item.capa-elfica",
 "name": "Capa élfica",
 "category": "Objeto maravilloso",
 "variant": null,
 "rarity": "infrecuente",
 "attunement": true,
 "attunementRequires": null,
 "subtitle": "Objeto maravilloso, infrecuente (requiere sintonización)",
 "text": "Mientras lleves esta capa, las pruebas de Sabiduría (Percepción) para percibirte se harán con desventaja y tú tendrás ventaja en las pruebas de Destreza (Sigilo).",
 "blocks": [
  {
   "type": "paragraph",
   "page": 247,
   "md": "Mientras lleves esta capa, las pruebas de Sabiduría (Percepción) para percibirte se harán con desventaja y tú tendrás ventaja en las pruebas de Destreza (Sigilo).",
   "text": "Mientras lleves esta capa, las pruebas de Sabiduría (Percepción) para percibirte se harán con desventaja y tú tendrás ventaja en las pruebas de Destreza (Sigilo)."
  }
 ],
 "source": {
  "book": "SRD 5.2.1 es",
  "page": 247
 }
}