{
 "id": "item.martillo-de-rayos",
 "name": "Martillo de rayos",
 "category": "Arma",
 "variant": "martillo de guerra o maza a dos manos",
 "rarity": "legendario",
 "attunement": true,
 "attunementRequires": null,
 "subtitle": "Arma (martillo de guerra o maza a dos manos), legendaria (requiere sintonización)",
 "text": "Recibes un bonificador de +1 a las tiradas de ataque y de daño que hagas con esta arma mágica.\n\nEl arma tiene 5 cargas. Puedes gastar 1 carga y hacer un ataque a distancia con el arma lanzándola como si tuviera la propiedad “arrojadiza”, con un alcance normal de 6 m y un alcance largo de 18 m. Si el ataque acierta, el arma suelta un trueno audible a 90 m. El objetivo y todas las criaturas (excepto tú) que estén a 9 m o menos de él deberán superar una tirada de salvación de Constitución con CD 17 o tendrán el estado de aturdidas hasta el final de tu siguiente turno. Inmediatamente después de acertar o fallar, el arma regresa volando a tu mano. El arma recupera 1d4 + 1 cargas empleadas cada día, al amanecer.\n\nMatagigantes. Mientras tengas sintonización con esta arma y lleves un cinturón de fuerza de gigante o unos guanteletes de fuerza de ogro con los que también te hayas sintonizado, obtienes los siguientes beneficios:\n\nAzote de gigantes. Si sacas un 20 en el d20 en una tirada de ataque con esta arma contra un gigante, este deberá superar una tirada de salvación de Constitución con CD 17 o morirá.\n\nFuerza de gigantes. La puntuación de Fuerza que te otorgan el cinturón de fuerza de gigante o los guanteletes de fuerza de ogro aumenta en 4, hasta un máximo de 30.",
 "blocks": [
  {
   "type": "paragraph",
   "page": 262,
   "md": "Recibes un bonificador de +1 a las tiradas de ataque y de daño que hagas con esta arma mágica.",
   "text": "Recibes un bonificador de +1 a las tiradas de ataque y de daño que hagas con esta arma mágica."
  },
  {
   "type": "paragraph",
   "page": 262,
   "md": "El arma tiene 5 cargas. Puedes gastar 1 carga y hacer un ataque a distancia con el arma lanzándola como si tuviera la propiedad “arrojadiza”, con un alcance normal de 6 m y un alcance largo de 18 m. Si el ataque acierta, el arma suelta un trueno audible a 90 m. El objetivo y todas las criaturas (excepto tú) que estén a 9 m o menos de él deberán superar una tirada de salvación de Constitución con CD 17 o tendrán el estado de aturdidas hasta el final de tu siguiente turno. Inmediatamente después de acertar o fallar, el arma regresa volando a tu mano. El arma recupera 1d4 + 1 cargas empleadas cada día, al amanecer.",
   "text": "El arma tiene 5 cargas. Puedes gastar 1 carga y hacer un ataque a distancia con el arma lanzándola como si tuviera la propiedad “arrojadiza”, con un alcance normal de 6 m y un alcance largo de 18 m. Si el ataque acierta, el arma suelta un trueno audible a 90 m. El objetivo y todas las criaturas (excepto tú) que estén a 9 m o menos de él deberán superar una tirada de salvación de Constitución con CD 17 o tendrán el estado de aturdidas hasta el final de tu siguiente turno. Inmediatamente después de acertar o fallar, el arma regresa volando a tu mano. El arma recupera 1d4 + 1 cargas empleadas cada día, al amanecer."
  },
  {
   "type": "definition",
   "page": 262,
   "md": "***Matagigantes.*** Mientras tengas sintonización con esta arma y lleves un *cinturón de fuerza de gigante* o unos *guanteletes de fuerza de ogro* con los que también te hayas sintonizado, obtienes los siguientes beneficios:",
   "text": "Matagigantes. Mientras tengas sintonización con esta arma y lleves un cinturón de fuerza de gigante o unos guanteletes de fuerza de ogro con los que también te hayas sintonizado, obtienes los siguientes beneficios:"
  },
  {
   "type": "definition",
   "page": 262,
   "md": "**Azote de gigantes.** Si sacas un 20 en el d20 en una tirada de ataque con esta arma contra un gigante, este deberá superar una tirada de salvación de Constitución con CD 17 o morirá.",
   "text": "Azote de gigantes. Si sacas un 20 en el d20 en una tirada de ataque con esta arma contra un gigante, este deberá superar una tirada de salvación de Constitución con CD 17 o morirá."
  },
  {
   "type": "definition",
   "page": 262,
   "md": "**Fuerza de gigantes.** La puntuación de Fuerza que te otorgan el *cinturón de fuerza de gigante* o los *guanteletes de fuerza de ogro* aumenta en 4, hasta un máximo de 30.",
   "text": "Fuerza de gigantes. La puntuación de Fuerza que te otorgan el cinturón de fuerza de gigante o los guanteletes de fuerza de ogro aumenta en 4, hasta un máximo de 30."
  }
 ],
 "source": {
  "book": "SRD 5.2.1 es",
  "page": 262
 },
 "refs": [
  "item.cinturon-de-fuerza-de-gigante",
  "item.guanteletes-de-fuerza-de-ogro"
 ]
}