{
 "id": "item.colgante-de-inmunidad-al-veneno",
 "name": "Colgante de inmunidad al veneno",
 "category": "Objeto maravilloso",
 "variant": null,
 "rarity": "raro",
 "attunement": true,
 "attunementRequires": null,
 "subtitle": "Objeto maravilloso, raro (requiere sintonización)",
 "text": "Esta elegante cadena de plata tiene un colgante con una gema negra de talla brillante. Mientras lo lleves puesto, tendrás inmunidad al estado de envenenado y al daño de veneno.",
 "blocks": [
  {
   "type": "paragraph",
   "page": 249,
   "md": "Esta elegante cadena de plata tiene un colgante con una gema negra de talla brillante. Mientras lo lleves puesto, tendrás inmunidad al estado de envenenado y al daño de veneno.",
   "text": "Esta elegante cadena de plata tiene un colgante con una gema negra de talla brillante. Mientras lo lleves puesto, tendrás inmunidad al estado de envenenado y al daño de veneno."
  }
 ],
 "source": {
  "book": "SRD 5.2.1 es",
  "page": 249
 }
}