{
 "id": "item.bola-de-cristal-de-leer-mentes",
 "name": "Bola de cristal de leer mentes",
 "category": "Objeto maravilloso",
 "variant": null,
 "rarity": "legendario",
 "attunement": true,
 "attunementRequires": null,
 "subtitle": "Objeto maravilloso, legendario (requiere sintonización)",
 "text": "Mientras tocas este orbe de cristal, puedes lanzar escudriñar (CD de salvación 17) desde él. Además, puedes lanzar detectar pensamientos (CD de salvación 17) haciendo objetivo a las criaturas que puedas ver a 9 m o menos del sensor del conjuro. No tienes que concentrarte en este conjuro detectar pensamientos para mantenerlo mientras dura, pero acabará si escudriñar también lo hace.",
 "blocks": [
  {
   "type": "paragraph",
   "page": 243,
   "md": "Mientras tocas este orbe de cristal, puedes lanzar *escudriñar* (CD de salvación 17) desde él. Además, puedes lanzar *detectar pensamientos* (CD de salvación 17) haciendo objetivo a las criaturas que puedas ver a 9 m o menos del sensor del conjuro. No tienes que concentrarte en este conjuro *detectar pensamientos* para mantenerlo mientras dura, pero acabará si *escudriñar* también lo hace.",
   "text": "Mientras tocas este orbe de cristal, puedes lanzar escudriñar (CD de salvación 17) desde él. Además, puedes lanzar detectar pensamientos (CD de salvación 17) haciendo objetivo a las criaturas que puedas ver a 9 m o menos del sensor del conjuro. No tienes que concentrarte en este conjuro detectar pensamientos para mantenerlo mientras dura, pero acabará si escudriñar también lo hace."
  }
 ],
 "source": {
  "book": "SRD 5.2.1 es",
  "page": 243
 },
 "refs": [
  "spell.escudrinar",
  "spell.detectar-pensamientos"
 ]
}